jvm_01519_00979130632	2158879c-4020-415e-a601-ae00203201c1	christ lauren nedhi tulung supaya kula mboten trisna malih dhateng piyambakipun
jvm_01519_01118502191	98bbc099-fea0-4540-8904-456f02aebf42	rihanna mung dipriksa minangka saksi kanggo kasuse chris brown
jvm_09724_00449423509	9206943c-f21b-45aa-bc4c-6ce97a00228d	wis ping pira ae dewi persik rabi
jvm_09724_01680860479	155b6485-ec01-4b54-a27d-d0bf0580bfc7	krungu krungu rolex iki jam paling larang sak ndonya
jvm_09724_01096655442	0eab3c52-3e20-4207-96cd-c7bcb7c0e03e	penerbangan saking cikarang napa ditunda
jvm_09724_01765223117	aa2c613a-0204-42de-8ff3-15e5c7fb0d96	venna melinda sampe saiki isih tukaran karo bojone
jvm_07765_00870976834	6b21aa91-45dd-4696-bcd8-2260a639cbec	gudel ingkang kaping sekawan paling seger buger
jvm_07765_01169722904	2ad065d2-1112-4484-a2c9-c8715cd2aaa2	maca berita seka telegraph iku isa nambah kekawruhane awak dhewe
jvm_09724_01870052194	8483ed99-a107-4882-a538-81e8c7cc9f4a	fariz r_letter m_letter riweh tandang gawe nang loteng omahe
jvm_09724_00580363410	a02e1418-e182-4146-90d0-0a74793552ab	piyambakipun matur badhe sinau teng_prep dompu
jvm_09724_00823081773	726e370c-105a-4d2d-bbca-28b281c58ab1	pandu logistics nyediake jasa kurir
jvm_09724_00888698706	9a6710e3-6bb3-47be-80c5-e0aaaabce3dc	cowek ingkang kangge ndamel bumbu ten seribu rasa gumpil
jvm_09724_01196631123	0430ed66-289d-470e-92b6-eb05018171da	mangan sop iga sapi ning pelabuhan cedhak kota malaka
jvm_01519_01074976674	d88bf0f7-315f-4857-8ca9-5a14ee8b7b6c	mbak citra sampun setaun dèrèng wangsul saking alor
jvm_07765_01510765964	e17a4d4d-888e-4b79-ba4c-f8a65a4cd80c	bubur sinar garut nambah menu dadi akeh banget
jvm_09724_01587523057	6f032bb1-5443-443e-9bda-06bbf771cefd	badhe manjat gendhèng griyanipun budhe ingkang teng_prep spanyol
jvm_07765_00083376018	094f7a88-ea66-412d-b149-e87f7c0e84b1	bumi serpong inggih menika usaha teng_prep bidang properti
jvm_07765_01650023912	f647dd74-8f25-45a5-ad87-d2cdfcc9cfab	century lagi keentekan sabun gudik
jvm_01519_00244746923	0457a163-0b1f-4133-a229-f9d9cec55487	peru wis semingkir ning babak pertama
jvm_01519_00452078417	d7bb3df7-caf5-4d0e-b0b8-bb447d3608d2	kawasaki wis suwe durung ngetokna produk maneh
jvm_09724_00625026543	74bf6b40-8eee-47ae-8c99-55ff89eb8564	nirvana sakmenika badhe ditumbas kalih bambang soeparmo
jvm_07765_02041341642	ea933d94-f207-457a-97b0-900d88fc4e69	bangunan rumah mode ketingal megah nggih
jvm_07765_00459296210	879d7672-a361-4385-9872-6ba303027195	menawi mlebet ankara mboten pikantuk visa
jvm_09724_01872352501	bdce5164-df52-4302-8f53-bd1377b3e6f7	vanessa angel nggadhahi grana ingkang ngudhup mlati uga lathi ingkang nyigar jambe
jvm_09724_00652396220	69ff179e-cce9-450e-a796-4eeb998be81f	denada mboten tepang kalih tiyang tiyang niku
jvm_09724_01592537518	fb519c34-0770-4fc7-8924-704d9ac40f5e	mbake rizky nasar kerja nang nggonane kantorku
jvm_09724_00662825466	568de152-a6b6-4525-ab5d-2d5ce951737d	universitas jendral sudirman anane ning purwokerto
jvm_09724_01980586437	90f599f5-bce6-4c26-94c5-c65cff8ff597	tuku sepatu lokal lan awet ya ning pasar cibaduyut
jvm_07765_00634968709	2f5394cd-8c0a-4aed-a11c-8c80a4831609	esemipun sule kados madu pinastika
jvm_01519_00743729803	e5befcd7-c367-43b9-9566-a45f030ba331	bedane karo pinjaman b_letter t_letter n_letter apa ya
jvm_09724_00584879693	fd95628e-9fed-4a2a-ba3f-9329a6764353	christina aguilera nyekeli rok cekake sing keterak angin nggebes
jvm_01519_00167130742	cb8c7b8e-a0a0-47a1-948a-6df62c9492ff	pak bupati ngajak lare lare dhahar teng_prep mang engking
jvm_01519_00566579067	1dceec37-4eac-4b5f-8890-633fdc64df11	upacara gendera arep dimulai jam wolu isuk
jvm_09724_01651449753	7cb489f3-7e0c-4ca5-85c8-675a82413703	bintaro menika sanes kutha ageng
jvm_09724_02078011304	76ed340f-70bf-4a98-8e6f-ef663bf8cdca	adhiku sing lanang laire tahun rong ewu
jvm_09724_00440141921	df9e2c3f-7696-4942-b943-1f4c77e4b083	randy pangalila ngenteni pengumuman saka kedutaan suwe banget
jvm_09724_00795238412	e605397a-36dc-4d86-8516-71fe1f1e9256	orang tua ngetokake bir modhel luar
jvm_01519_00188565600	22c43540-3dd4-45dc-813f-1c03fdf5d06f	wis jan ciptaane gusti allah apik ora lumrah ning gili trawangan
jvm_09724_00819200014	62905fd7-e701-4d6f-a8c9-043161d9c81e	boneka poppy biyen diperanke ambèk diana pungky
jvm_09724_01332460150	d428ddbd-aa7c-40b8-892f-91b5188cf5b7	prima jasa ditilang pulisi amarga nyalip liwat kiwa
jvm_09724_01441533675	46d1f779-179a-44c9-98b5-e689733c57f9	nek_conj awakmu macem macem tak warahna courteney cox lho
jvm_09724_00756506269	30eb53e0-1ed3-4d89-8b26-3d2d3f09ff67	freddie mercury budal ngetan jarene arep ndandakna motore
jvm_01519_01667798009	d61808e9-0600-47fc-a00a-0bdf69caa930	wedhakipun skin food cocok kagem kulit tiyang enom
jvm_01519_02105151430	0aad9b8a-1881-4d65-95e5-e84c50657194	surya saputra nggendhong anake ngalor ngidul ngetan ngulon
jvm_09724_00535514088	05e0de36-bc65-476c-a310-f11e024415f6	acara apik sing disiarna h_letter b_letter o_letter kuwi opo ae ya
jvm_09724_00890267688	9f62bf10-d445-46ae-95e0-499b6fe862de	pejabat sing paling dhuwur ning yozawa sapa jenenge
jvm_09724_00582237761	f3c4ef01-ed52-49af-b6d1-deadce2e6287	menawi badhe mirsani balapan kedah mirsani tayangan jam kalih seprapat enjing
jvm_07765_01936321005	57808fc1-628b-4a49-ab1b-69faeed7d275	kopi kopi metunane kapal api group paite ora memper
jvm_07765_01245579400	6c996336-b3e8-4596-8872-5986c8e3db81	agus ngaku ngaku dadi anake pak r_letter t_letter ben isa oleh warisan
jvm_07765_00791951293	7355e1fc-3584-484a-a967-5c3c34067121	gemblong bu juju menika kathah disade ten serpong
jvm_01519_00171181608	1ad4bd2e-2a16-4322-9948-6c986a4d1db4	erna mari tuku montor suzuki pas nang pameran wingi
jvm_09724_00583046046	0d884d38-54f7-4d31-b1f8-1efca6a9ad72	nedha ès grim teng_prep haagen dazs saged kalih linggih teng_prep dalem tokonipun
jvm_09724_01286052015	9b6aa2ed-c2ba-475b-9a72-b2630fee800a	celananipun namung wonten ten croozt
jvm_09724_00313851806	3ab9bfc1-5cb3-4a69-8ac3-7af0638987db	mbok ya transit sik ning bandhara internasional ataturk
jvm_07765_00493891118	f7837ff5-3838-44b4-91c7-458179af51e0	saiki stasiun ambarawa wis dadi museum
jvm_01519_00846589633	3517cdd6-095f-4c03-b8cf-67814bc61924	mbak esti dados pelayan teng_prep toko naughty
jvm_07765_00534340223	c5557396-4b6e-425d-af17-7f40d96531d6	mangke wangsulipun miyos kantor dunia tera
jvm_09724_01737791103	cf2f4010-43df-4323-9ab3-69ca1c7bc70e	ne yo diluk engkas arep comeback ambèk lagune sing kontroversial iku
jvm_07765_00282479978	b3027d48-a4cd-4510-be0f-8a844619d895	pak lurah biasane mlayu mlayu dina kemis isuk
jvm_01519_01648183131	104e0bf4-211c-42e0-a0d1-9d85adff45e2	menawi kerang ingkang eca padhos ten warung
jvm_01519_01530900472	383822ec-d43c-4a41-a679-0826d6c197b5	meja ingkang panjenengan pundhut jumlahipun seket_nou-num iji
jvm_07765_01446634386	89e0b8b4-8901-484e-a45f-658a631ad0d2	machu picchu ki sakjane isine mung watu sing bentuke ora nggenah tapi ketok apik
jvm_07765_00891490900	c400659d-cdad-4fb0-a7c2-800afc6a8e62	usia minimal yen arep ndaftar relawan iku patang puluh taun
jvm_07765_01792446307	74878daf-b119-4eef-b515-83a0280a1fb8	potonganmu tambah mbois pas nggawe sepatu reebok iku
jvm_09724_00599660279	58abd89d-f73e-4d57-967b-e87160132666	njenengan kapan badhe teng_prep daleme christian bale
jvm_07765_01563665272	586c3f77-e4ff-46f5-bfd3-a30ae0c69806	kathoke giovanni adhem gawen gawenane
jvm_07765_00983812511	4c4b6200-143b-430a-b69e-5ab7408aa14f	yen pingin aman ya mending asuransi jiwasraya
jvm_01519_00378733424	0988cefe-eb47-4714-9958-66dc5d5858a0	bahama karo negarane dhewe sugih endi
jvm_09724_02054135522	4c9a02f0-1af5-452d-890b-306e6fe7da5d	candi prambanan kuwi nduweni garis lurus menyang laut kidul
jvm_09724_01804359491	39f15e55-e75e-4048-8cde-6e8a56b9fe67	paling pas pancen ning rakuten belanja online apa wae ana lan murah
jvm_07765_00736771400	3a8f23bd-e314-4f9b-bd25-89dd411d6bb9	sing nggo syuting the hobbit kae apa ning selandia baru
jvm_07765_01887533403	77f84589-8970-472d-81ee-137eca61fbdd	portia de rossi sampun mutusaken mboten ajeng nggadhah yuga saklawase
jvm_09724_01390379119	eab8abc2-f46e-4de8-b244-a8e282dbcfa9	tiyang mriki kathah kang mboten semerap naver niku napa
jvm_07765_00820197700	cf148ecd-89a5-4ad4-a9ca-aeaffdc54ec7	fotonipun dijepret teng_prep kebon plataran dharmawangsa
jvm_07765_00582459717	26c65223-7f2c-4137-9f3a-676675b18598	kucingipun mbah darmo nglairaken gangsal lucu lucu
jvm_09724_00093236343	350639d3-6244-4de3-8edd-ed529119f0d5	gerejane ana ning sak lore taman nasional fiordland
jvm_07765_01252522537	d9236f15-238a-47b2-92b0-0380ef5e220a	liga bulgaria disponsori dening perusahaan rokok
jvm_07765_00958406549	9a29df80-8fdd-474b-b1a3-dffb560df135	gedungipun sampun dipunrehab lan sak menika niku kaping sedasa
jvm_09724_00948732963	48187f03-8fd1-4caa-9153-da58f153dd54	apa diadora uga mroduksi kaos singlet
jvm_07765_00601548795	b975c893-e62e-484c-b66d-9f08738cd5fc	apeme dikukus sak menit meneh suwine
jvm_07765_01525999723	da724e0a-b68f-494a-b51b-feba5716df53	sumber banyu ing gunung sindoro sumbing wis sat
jvm_07765_01403272126	07068153-bc80-4439-a1b9-7d1ea8e47d59	kompas gramedia pancen top tenan
jvm_09724_00790996449	1fce117e-c405-4a3e-9dfe-36bf36d87d3c	menawi tasih mboten sreg njenengan saged kandha teng_prep kantor pusate pearson
jvm_07765_00494020328	532f2f29-b907-4fd2-90b8-555403be311d	juni mangke artanipun telas
jvm_09724_01384043946	38e7c141-6ccf-4763-a537-799f7c4ba4aa	slamete omahe rooney mara nggak kenek udan awune gunung bromo
jvm_09724_01914705772	d2b45447-d4ee-4582-a965-d5e80865656b	pingine turu ning fukushima tapi pakdheku emoh
jvm_09724_01365346142	75e90c13-6716-4ee0-a7e2-843aeba1452b	kula ngarep arep supaya rio haryanto dipun undang dateng tim mclaren
jvm_07765_00118293044	b3cdfd0b-2221-4879-9939-bb358dfafc7b	kula badhe ten kantor pos sekedhap namung gangsal welas menit
jvm_09724_01639856928	3182e574-3973-446d-9245-34df94d5fc30	ridho rhoma gawe roti saka glepung endhog lan banyu
